{
  "already_present_environment_names": [
    "R2_ENDPOINT_URL",
    "R2_BUCKET",
    "QDRANT_URL"
  ],
  "authority": {
    "live_read_execution": false,
    "pa3_execution": false,
    "secret_provisioning_execution": false,
    "stage_acceptance": false
  },
  "authorized": false,
  "future_exact_run": {
    "environment": "m23-r3-diagnostic",
    "github_run_attempt_expected": 1,
    "logical_attempt": 2,
    "new_authorization_and_main_push_required": true,
    "rerun_of_attempt_1_forbidden": true,
    "same_read_surface_as_attempt_1": true,
    "workflow_name": "M26.PA.2 Exact Live Read-Only Evidence"
  },
  "logical_attempt": 2,
  "predecessor": {
    "data_plane_operations": 0,
    "failed_closed": true,
    "failure_self_sha256": "9724218f4cebbd82d6d35093d913d5105f2098343194e1a2c10748323301c6f5",
    "logical_attempt": 1,
    "run_id": 30242723869
  },
  "provisioning_requirements": {
    "all_required_names_must_be_nonempty_before_authorization": true,
    "qdrant_api_key_must_be_read_only": true,
    "r2_credentials_must_be_read_only": true,
    "secret_values_must_not_be_logged_or_persisted": true,
    "write_scoped_substitution_forbidden": true
  },
  "required_environment": "m23-r3-diagnostic",
  "required_secret_names": [
    "R2_ACCESS_KEY_ID_READ",
    "R2_SECRET_ACCESS_KEY_READ",
    "QDRANT_READ_ONLY_API_KEY"
  ],
  "schema_version": "knowledge-engine-m26-pa-2-attempt-2-readiness/v1",
  "self_sha256": "0bf622ea104ecde8f808aa80f827ad4c4ec98f972c1786818934666b3b63f6fe",
  "stage_id": "M26.PA.2",
  "status": "blocked_on_exact_read_only_credentials",
  "triggerable": false
}
